recipe_id,name_he,name_en,type,ingredients,preparation,frequency_duration,targets,evidence_summary,main_ingredients_with_evidence,primary_refs
R1,חליטת ערב להרגעה ושינה,Evening calming sleep infusion,hot_drink,Chamomile flowers; Lemon balm leaves (optional); Lavender flowers (optional); Oat drink or water,Steep 1 tea bag or 1-2 tsp dried chamomile in 200-250 ml just-boiled water for 5-10 minutes. Optionally add 1 tsp dried lemon balm and/or 0.5-1 tsp dried lavender. Drink 30-60 minutes before sleep.,"1 cup in the evening, daily for 2-4 weeks",sleep_quality; anxiety_reduction; relaxation,Chamomile oral preparations improved generalized anxiety and showed signals for better sleep in RCTs. Lemon balm extracts improved sleep quality and reduced anxiety in several clinical trials. Lavender herbal tea and aromatherapy improved sleep and reduced anxiety/depression in women and elderly populations.,Chamomile; Lemon balm; Lavender,PMC3600416; pubmed/19593179; e-cnr.org/journal/view.php?number=343; PMC11510126; sciencedirect.com/article/abs/pii/S1876382018309892; digitalcommons.pcom.edu/pa_systematic_reviews/330; semanticscholar lavender tea sleep
R2,משקה היביסקוס קר ללחץ דם,Cold hibiscus blood-pressure drink,cold_drink,Dried hibiscus calyces; Water; Optional: lemon juice; Small amount of non-sugar sweetener or small amount of honey/date syrup,"Steep 1-2 tbsp dried hibiscus in 500 ml hot water for 10-15 minutes, then strain and chill. Add lemon juice to taste and minimal sweetener if desired.",1-2 cups daily for 4-8 weeks,blood_pressure_reduction; vascular_health; antioxidant_support,"Hibiscus sabdariffa teas lowered systolic and diastolic blood pressure in multiple RCTs and meta-analyses, with modest effects on fasting glucose and lipids.",Hibiscus,PMC6621350; ars.usda.gov hibiscus tea lowers blood pressure; Wiley sour tea meta-analysis; PMC9086798
R3,משקה עיכול – נענע וג׳ינג׳ר,Digestive peppermint-ginger infusion,hot_drink,Fresh or dried peppermint leaves; Fresh ginger root slices; Lemon slice (optional),"Place 5-10 fresh peppermint leaves (or 1-2 tsp dried) and 2-3 thin ginger slices in 250 ml boiling water. Steep 5-10 minutes and drink warm, preferably after meals.","1 cup after main meals, up to 2-3 times per day",IBS_symptoms_relief; nausea_reduction; general_digestion,"Enteric-coated peppermint oil capsules significantly improved IBS symptoms in multiple RCTs and meta-analyses. Ginger reduced nausea in post-operative, pregnancy and chemotherapy settings in systematic reviews of RCTs. Infusion provides lower doses but combines both actives.",Peppermint oil; Ginger,pubmed/26319955; pubmed/24100754; jmsh.ac.in peppermint oil IBS; pubmed/10793599; asco ginger chemotherapy trial; PMC6341159
R4,לאטה קקאו ושיבולת שועל ללב ולמוח,Cocoa oat-heart and brain latte,hot_drink,Unsweetened cocoa powder; Oat drink rich in beta-glucan; Cinnamon; Small amount of sweetener if needed,Heat 200-250 ml oat drink. Whisk in 1-2 tsp unsweetened cocoa powder and 0.5 tsp cinnamon until smooth. Do not boil strongly; serve warm.,"1 cup daily, long term",LDL_cholesterol_reduction; vascular_function; cognitive_performance,"Oat beta-glucan beverages (≥3 g/day) reduce LDL cholesterol by about 5–7% in RCTs. Cocoa flavanols acutely improve cerebral blood flow, endothelial function and aspects of cognitive performance in controlled trials. Cinnamon supplementation modestly improves fasting glucose and insulin resistance in T2DM.",Oat beta-glucan; Cocoa flavanols; Cinnamon,PMC6892284; frontiersin.org/articles/10.3389/fnut.2019.00171; pubmed/34236436; nature.com/articles/s41598-020-76160-9; sciencedirect.com/article/pii/S0531556520300516; pubmed/37818728; PMC7728608
R5,לאטה כורכום-ג׳ינג׳ר (חלב זהוב),Turmeric-ginger golden oat latte,hot_drink,"Turmeric powder; Fresh grated ginger; Black pepper; Oat or soy drink; Small amount of fat (e.g., tahini or small amount of oil)","Heat 200-250 ml plant drink with 0.5-1 tsp turmeric, 0.5 tsp fresh grated ginger and a pinch of black pepper. Simmer gently 5 minutes while stirring; optionally add 1 tsp tahini or a few drops of oil to improve curcumin absorption.",1 cup daily for at least 4-8 weeks,depressive_symptoms_support; anti_inflammatory; joint_pain_support,Curcumin supplements showed moderate reductions in depressive symptoms in patients with major depressive disorder and reduced inflammatory markers in several RCTs and meta-analyses. Ginger has anti-inflammatory and analgesic effects in some musculoskeletal conditions.,Curcumin (turmeric); Ginger,wiley.com/ptr.5524; PMC7728608; PMC8863697; frontiersin.org/articles/10.3389/fphar.2025.1638645; PMC6341159
R6,תה ירוק עם רוזמרין לפוקוס וזיכרון,Green tea rosemary focus drink,hot_drink,Green tea leaves or bag; Small sprig of fresh rosemary or 0.25-0.5 tsp dried; Lemon slice (optional),"Steep 1 tsp green tea and a small sprig of rosemary (or 0.25-0.5 tsp dried) in 200 ml water at ~80 °C for 3-4 minutes, then remove leaves/herb.",1-2 cups in the morning or early afternoon,working_memory; attention; alertness,"Green tea (caffeine + L-theanine) improves working memory performance and modulates brain activity in human trials. A rosemary-containing tomato juice drink and beverages with rosemary showed acute improvements in speed of memory, alertness and contentedness in older adults.",Green tea; Rosemary,pubmed/28899506; kcl.ac.uk green tea cognition PDF; frontiersin.org/articles/10.3389/fnagi.2022.919766; liebertpub.com/jmf.2011.0005; mccormickscienceinstitute.com rosemary and cognitive function; neurosci7010015
R7,מרק עדשים אנטי-דלקתי,Anti-inflammatory lentil garlic-turmeric soup,soup,Red or brown lentils; Onion; Garlic; Carrot; Celery; Turmeric; Ginger; Rosemary or sage; Olive oil; Salt and pepper,"Sauté chopped onion and 2-3 minced garlic cloves in 1-2 tbsp olive oil. Add 1-2 tsp turmeric, 1 tsp grated ginger and 0.5 tsp chopped rosemary or sage and toast briefly. Add 1 cup lentils, chopped carrot and celery, and 1.5-2 liters water or vegetable stock. Simmer 30-40 minutes until lentils are soft.",1 bowl daily or several times per week as part of meals,blood_pressure_support; lipid_profile_support; anti_inflammatory; satiety_weight_management,Garlic preparations modestly reduce blood pressure and improve lipids in hypertensive patients. Turmeric/curcumin and ginger have anti-inflammatory effects. Legume-based soups support weight management and glycemic control in observational and intervention studies.,Garlic; Turmeric/curcumin; Ginger,PMC8031974; frontiersin.org/articles/10.3389/fnut.2025.1656809; PMC7728608; PMC6341159
R8,משקה קינמון ושיבולת שועל לאיזון סוכר,Cinnamon oat glycemic support drink,hot_drink,Fine oats; Cinnamon powder (preferably Ceylon); Water or unsweetened oat/soy drink,Cook 2-3 tbsp fine oats in 200-250 ml water or plant drink for 3-5 minutes to make a thin porridge-like drink. Stir in 0.5-1 tsp cinnamon at the end and serve warm.,Once daily with breakfast for at least 8-12 weeks,fasting_glucose_reduction; insulin_resistance_support; LDL_reduction,"Cinnamon supplementation in T2DM modestly reduced fasting glucose, HOMA-IR and sometimes lipids in meta-analyses. Oat beta-glucan lowers LDL cholesterol and improves some features of metabolic syndrome.",Cinnamon; Oat beta-glucan,pubmed/37818728; PMC3767714; nutritionreviews 83(2):249 cinnamon; PMC6892284; frontiersin.org/articles/10.3389/fnut.2019.00171
R9,תה צמחים משולב לשינה ושקט נפשי,Mixed herbal sleep and calm tea,hot_drink,Chamomile; Lemon balm; Lavender; Optional: small amount of valerian root if available,"Combine 1 tsp chamomile, 1 tsp lemon balm and 0.5 tsp lavender in a tea infuser with 250 ml boiling water. Steep 10 minutes. Optionally add a small amount of valerian root according to product instructions.","1 cup in the evening, up to 2 cups/day for several weeks",sleep_quality; anxiety_reduction; stress_reduction,A combination of lemon balm and valerian as tablets improved sleep quality and reduced insomnia indices in RCTs. Lemon balm monotherapy reduced anxiety and improved sleep in several clinical settings. Lavender herbal tea improved sleep quality in elderly and reduced anxiety/depression scores in some trials.,Lemon balm; Chamomile; Lavender; Valerian,PMC11510126; scholarsresearchlibrary.com lemon balm sleep; sciencedirect.com/article/abs/pii/S1876382018309892; semanticscholar lavender herbal tea elderly; sciencedirect.com/article/abs/pii/S0965229919316292
R10,משקה עגבניות ורוזמרין לקשב וזיכרון,Tomato-rosemary cognitive drink,cold_or_room_temp_drink,Low-sodium tomato juice; Dried rosemary powder,"Mix 250-300 ml reduced-sodium tomato juice with approximately 750 mg (about 1/4 tsp) dried rosemary powder. Stir well and drink once, preferably with a light meal.",Single-dose use before demanding cognitive tasks; in studies used acutely,speed_of_memory; cognitive_performance; alertness,"A randomized crossover study in older adults showed that a tomato juice drink containing 750 mg dried rosemary improved speed of memory compared with placebo, whereas higher doses impaired performance.",Rosemary; Tomato juice polyphenols,liebertpub.com/jmf.2011.0005; mccormickscienceinstitute.com rosemary and cognitive function; Annex Publishers Cognitive Enhancers Derived from Edible Crops
R11,משקה זרעי פשתן ולימון ללחץ דם,Flaxseed-lemon blood pressure drink,cold_drink,Ground flaxseed; Water; Lemon juice; Optional: small amount of honey,Mix 1 tbsp freshly ground flaxseed into 250 ml room-temperature or slightly warm water. Add juice of half a lemon and minimal honey if desired. Stir well and drink soon so the mucilage does not fully gel.,1 glass daily with a meal for at least 8-12 weeks,blood_pressure_reduction; lipid_profile_support; satiety_weight_management,Meta-analyses and RCTs show flaxseed products modestly reduce systolic and diastolic blood pressure and may improve total cholesterol in hypertensive or high-risk individuals.,Flaxseed,PMC11543448; pubmed/26071633; sciencedirect.com/article/pii/S1550830721000938; koreascience.kr flaxseed meta-analysis
R12,מיץ רימונים מדולל ללב ולחץ דם,Diluted pomegranate heart drink,cold_drink,100% pomegranate juice; Water,Dilute 100-150 ml 100% pomegranate juice with an equal volume of water (to reduce sugar load) and drink with or between meals.,1 glass daily for up to 1-2 months,blood_pressure_reduction; vascular_health; antioxidant_support,Systematic reviews and meta-analyses of RCTs show that up to ~300 ml/day pomegranate juice for ≤2 months reduces systolic and diastolic blood pressure by around 4-6 mmHg in various populations.,Pomegranate juice,onlinelibrary.wiley.com/doi/10.1002/ptr.7952; pubmed/27888156; sciencedirect.com/article/S2405457718300172; PMC5672313
R13,שייק אוכמניות ושיבולת שועל לקוגניציה,Blueberry-oat cognitive smoothie,cold_drink,Frozen or fresh blueberries; Oat drink or water + oats; Banana or apple; Ground flaxseed (optional),"Blend 1 cup blueberries, 200 ml oat drink (or water + 2 tbsp oats), half a banana or 1 small apple, and 1 tbsp ground flaxseed until smooth.",1 smoothie daily for 8-12 weeks,memory_support; executive_function_support; antioxidant_support,"Blueberry juice or freeze-dried powder improved verbal memory and some executive functions in randomized controlled trials in older adults and midlife individuals, with trends toward better mood and glucose control.",Blueberries; Oats; Flaxseed (optional),PMC2850944; sciencedirect.com/article/pii/S0889159118311954; blueberry.org cognitive function trial; PMC9031005
R14,מים בתוספת אוכמניות ולימון (הידרציה פלוס),Blueberry-lemon infused water,cold_drink,Still water; Handful of blueberries; Lemon slices,Place a handful of blueberries and 2-3 lemon slices in a 1-liter bottle of water and let infuse in the fridge for several hours. Drink throughout the day.,Up to 1-2 liters/day as main hydration source,hydration; mild_cognitive_support; mood_support,Hydration RCTs show that restoring water intake after restriction improves cognitive performance and mood. Blueberries add polyphenols that may benefit memory and executive function in the long term.,Water; Blueberries,pubmed/34684650; PMC6603652; PMC4207053; PMC6413851; PMC2850944; PMC9031005
R15,"שייק ירוק פשוט (תרד, בננה, שיבולת שועל)",Simple green spinach-banana oat smoothie,cold_drink,Fresh spinach; Banana; Oat drink or water + oats; Lemon juice,"Blend 1-2 handfuls fresh spinach, 1 banana, 200 ml oat drink (or water + 2 tbsp oats) and a splash of lemon juice until smooth.",1 smoothie daily or several times per week,general_micronutrient_support; satiety_weight_management; metabolic_health_support,"Green leafy vegetables, whole grains and plant-based dietary patterns are consistently associated with lower cardiometabolic risk and slower cognitive decline in cohort studies, forming the basis of patterns like the Mediterranean and MIND diets.",Leafy greens; Whole grains,"PLOS herbs and spices benefits; observational data on Mediterranean/MIND diets (e.g., Morris et al., 2015); nutritionreviews polyphenols and cognition"
R16,משקה סלק ולימון לפני פעילות,Beetroot-lemon pre-exercise drink,cold_drink,Beetroot juice (or cooked beetroot blended with water); Lemon juice,Use 200-250 ml commercial beetroot juice or blend 1 small cooked beetroot with water to 250 ml and add lemon juice. Drink 1.5-2 h before exercise.,"Before aerobic sessions, a few times per week",blood_pressure_support; exercise_performance_support; vascular_function,Nitrate-rich beetroot juice lowers central systolic blood pressure by ~5 mmHg acutely and can enhance cardiovascular responses to submaximal exercise in hypertensive and other populations.,Beetroot juice (nitrate),PMC3545899; PMC6369216; PMC6413851; sciencedirect.com/article/abs/pii/S0891584923011401
R17,תערובת זרעי צ׳יה ופשתן ליוגורט/דייסה,Chia-flax topping for porridge or plant yogurt,add_on,Ground flaxseed; Whole chia seeds; Crushed walnuts (optional),Mix 1 tsp ground flaxseed with 1 tsp chia seeds (and 1 tbsp crushed walnuts if desired) and sprinkle over oat porridge or unsweetened soy/oat yogurt.,Once daily with breakfast,blood_pressure_reduction; lipid_profile_support; omega3_intake; satiety,"Flaxseed meta-analyses show modest reductions in blood pressure and cholesterol; walnuts and chia contribute plant omega-3 and polyphenols, with walnuts showing possible benefit in subgroups for cognitive decline risk.",Flaxseed; Walnuts; Chia (ALA),PMC11543448; pubmed/26071633; pubmed/31912155; PMC7071526; pubmed/34132152
R18,סלט עדשים קר עם ירקות ושמן זית,Cold lentil-vegetable olive oil salad,meal_salad,Cooked lentils; Tomato; Cucumber; Red onion; Parsley; Olive oil; Lemon juice; Garlic,"Mix 1-2 cups cooked lentils with chopped tomato, cucumber, red onion and parsley. Dress with 1-2 tbsp olive oil, lemon juice, minced garlic, salt and pepper.",As a main or side dish several times per week,cardiometabolic_risk_reduction; satiety_weight_management; blood_pressure_support,Legumes and extra-virgin olive oil are core components of Mediterranean-style diets that reduce cardiovascular events and improve metabolic risk factors in large RCTs and cohorts.,Lentils (legumes); Olive oil; Garlic,"PREDIMED trial reports; PMC8031974 garlic BP; Mediterranean diet RCTs (Estruch et al., 2013)"
R19,מרק ירקות בסיסי עם שום ושיבולת שועל,Basic vegetable soup with garlic and oat,soup,"Onion; Garlic; Carrot; Celery; Zucchini; Handful of oats; Olive oil; Herbs (parsley, thyme)","Sauté onion and garlic in olive oil, add chopped vegetables and 1-2 tbsp oats, cover with water and simmer 25-30 minutes. Season with herbs.",1 bowl daily or a few times per week,satiety_weight_management; blood_pressure_support; lipid_profile_support,"Vegetable-rich, high-fiber soups improve satiety and help weight and metabolic control; oats add beta-glucan for LDL reduction and garlic supports blood pressure and lipids.",Oats; Garlic; Vegetables,PMC6892284; frontiersin.org/articles/10.3389/fnut.2019.00171; PMC8031974; Mediterranean-style dietary pattern data
R20,"תה ירוק, לימון ומנטה (אנרגיה עדינה)",Green tea lemon-mint light energy drink,hot_or_cold_drink,Green tea; Fresh mint; Lemon juice,Steep green tea with a handful of fresh mint leaves in 200 ml hot water (80 °C) for 3-4 minutes. Add lemon juice and optionally chill for iced tea.,1-2 cups in the morning or early afternoon,alertness; working_memory; digestion_support,"Green tea improves aspects of cognition and mood, while mint-derived preparations reduce IBS symptoms; lemon adds palatability and vitamin C without specific RCTs for this mix.",Green tea; Peppermint,pubmed/28899506; PMC7570631; pubmed/24100754; PMC6341159
R21,משקה מים לפי משקל גוף (הידרציה מובנית),Structured body-weight-based water intake,guideline,Plain water,"Guideline: aim for approximately 30-35 ml water per kg body weight per day from beverages and high-water foods, adjusting for climate and activity. Spread intake over the day.","Daily, long term",hydration; cognitive_performance_support; mood_support,"RCTs and reviews on hydration show that mild dehydration (1-2% body water loss) can impair attention, reaction time and mood, and that water supplementation after restriction improves these outcomes.",Water,pubmed/34684650; PMC6603652; PMC4207053; pubmed/24480458
R22,חליטת מרווה ולימונית למיקוד רגוע,Sage-lemon balm calm focus tea,hot_drink,Dried sage leaves; Lemon balm leaves; Optional: small amount of honey,Steep 0.5-1 tsp dried sage and 1 tsp dried lemon balm in 200 ml boiling water for 5-7 minutes.,Up to 2 cups/day,working_memory; anxiety_reduction; stress_reduction,"Sage extracts improved working memory and attention in RCTs, while lemon balm reduced anxiety and improved sleep and general calmness in clinical trials.",Sage; Lemon balm,PMC7828691; pubmed/33466627; PMC11510126; sciencedirect.com/article/abs/pii/S1876382018309892
R23,מים עם חומץ תפוחים ולימון לפני ארוחה,Apple cider vinegar-lemon pre-meal drink,cold_drink,Apple cider vinegar; Water; Lemon juice,Dilute 1-2 tsp apple cider vinegar in 200 ml water with lemon juice. Drink just before or with a high-carbohydrate meal.,Once daily before largest carb meal,postprandial_glucose_support; satiety,Small RCTs show that vinegar ingestion with meals blunts postprandial glucose spikes and improves insulin sensitivity in individuals with insulin resistance or type 2 diabetes.,Vinegar (acetic acid),Johnston et al. vinegar glucose trials; nutritionreviews vinegar insulin sensitivity studies
R24,"שייק בוקר מהיר – בננה, שיבולת שועל, שקדים","Quick breakfast smoothie – banana, oats, almonds",cold_drink,Banana; Oats; Almonds or almond butter; Water or almond drink,"Blend 1 banana, 2-3 tbsp oats, 10-15 almonds (or 1 tbsp almond butter) and 200 ml water/almond drink until smooth.",Once daily as breakfast,satiety_weight_management; cardiometabolic_support; sustained_energy,"Nuts and whole grains are associated with lower cardiovascular risk and better weight control in cohorts; almonds improve lipid profiles, while oats contribute beta-glucan for LDL reduction.",Almonds; Oats,Prospective nut consumption CV risk studies; PMC6892284; frontiersin.org/articles/10.3389/fnut.2019.00171
R25,"חטיף תמרים, אגוזים ושקדים",Date-walnut-almond snack balls,snack,Dates; Walnuts; Almonds; Cocoa powder (optional),"Blend equal parts pitted dates, walnuts and almonds (and 1-2 tbsp cocoa if desired) to a paste, roll into small balls and chill.",1-2 small balls per day as snack,cardiometabolic_support; satiety; mood_support,Nut-rich snacks improve dietary quality and cardiometabolic markers; walnuts may help delay cognitive decline in at-risk subgroups; cocoa adds flavanols linked with vascular and cognitive benefits.,Walnuts; Almonds; Cocoa,PMC7071526; pubmed/31912155; PMC3575938; nature.com/articles/s41598-020-76160-9
R26,תבשיל חומוס וירקות בשמן זית,Chickpea-vegetable olive oil stew,stew,"Cooked chickpeas; Onion; Garlic; Tomato; Zucchini or eggplant; Olive oil; Spices (turmeric, cumin)","Sauté onion and garlic in olive oil, add spices, then chickpeas and chopped vegetables. Add water and simmer until vegetables are soft.",Main meal several times per week,cardiometabolic_risk_reduction; satiety_weight_management; anti_inflammatory_support,"Legume- and olive-oil-rich meals form a central part of Mediterranean diets, which reduce cardiovascular events; turmeric adds anti-inflammatory curcumin.",Chickpeas; Olive oil; Turmeric,PREDIMED Mediterranean diet; PMC7728608; legume intervention trials
R27,"דייסת שיבולת שועל עם קינמון, תפוח ופשתן","Oat porridge with cinnamon, apple and flax",hot_meal,Oats; Water or plant drink; Apple; Cinnamon; Ground flaxseed,"Cook oats in water or plant drink. In the last minutes add chopped apple, 0.5-1 tsp cinnamon and 1 tbsp ground flaxseed.",Daily breakfast or several times per week,LDL_reduction; fasting_glucose_support; satiety_weight_management,Oat beta-glucan lowers LDL and improves metabolic risk factors; cinnamon modestly improves glycemic indices; flaxseed aids blood pressure and lipid control.,Oats; Cinnamon; Flaxseed,PMC6892284; frontiersin.org/articles/10.3389/fnut.2019.00171; pubmed/37818728; PMC3767714; pubmed/26071633
R28,"תה ג׳ינג׳ר, לימון ודבש לשיעול ובחילה קלה",Ginger-lemon-honey soothing tea,hot_drink,"Fresh ginger; Lemon; Honey (optional, vegetarian but not vegan)",Slice 2-3 thin slices of fresh ginger and steep in 200 ml boiling water for 10 minutes. Add lemon juice and 1-2 tsp honey if desired.,Up to several cups per day as needed,nausea_reduction; throat_soothing; general_comfort,"Ginger reduces nausea in several RCTs across pregnancy, postoperative and chemotherapy settings. Honey is often used for cough relief, though evidence is mixed; lemon mainly adds palatability.",Ginger; Honey (cough relief),pubmed/10793599; PMC6341159; oncology ginger trials; pediatric honey cough studies
R29,משקה שיבולת שועל קריר לפני שינה (ללא קפאין),Cool oat bedtime drink (caffeine-free),cold_or_hot_drink,Oat drink; Cinnamon; Small amount of vanilla; Optional: chamomile extract or tea bag,"Warm or chill 200 ml oat drink with 0.5 tsp cinnamon and a little vanilla. Optionally steep a chamomile tea bag in the warm drink for 5 minutes, then remove.",1 cup 30-60 minutes before bedtime,sleep_support; relaxation; nocturnal_satiety,"Chamomile improves anxiety and possibly sleep quality in RCTs; a low-glycemic, warm carbohydrate drink may aid sleep onset and prevent nocturnal hunger.",Chamomile; Oats,PMC3600416; pubmed/19593179; e-cnr.org chamomile anxiety; oatmeal sleep observational insights
R30,משקה בוקר – מים חמימים עם לימון ופוליפנולים,Morning warm water with lemon and polyphenol add-on,hot_drink,Warm water; Lemon juice; Optional: small amount of green tea or hibiscus concentrate,Combine 200-300 ml warm water with juice of half a lemon. Optionally add a small amount of concentrated cooled green tea or hibiscus infusion for polyphenols.,Once each morning on waking,hydration; gentle_awakening; vascular_support,Starting the day with water supports hydration; green tea and hibiscus infusions provide polyphenols associated with improved vascular function and lower blood pressure in RCTs.,Water; Green tea; Hibiscus,pubmed/24480458; PMC4207053; pubmed/28899506; PMC6621350; PMC9086798
